"id","category_name","question","answer","created_at","updated_at","section_title","tool_slug"
"4","Tool-Features","How can TS Scout product research tools help me identify the hottest trending products for my Shopify store?","TS Scout's advanced product research capabilities allow you to quickly identify the most in-demand, trending products across multiple marketplaces like AliExpress and Shopify. By analyzing sales data, customer reviews, and market insights, tsscout.com surfaces the top trending products that are primed for success in the dropshipping space.","2024-08-21 23:36:25","2025-08-30 01:06:59","Tools and Use (Shopify)","shopify-insight"
"5","Tool-Features","What kind of data and analytics does TS Scout provide to help me find profitable, trending products for Shopify?","TS Scout offers comprehensive Shopify product research tools that leverage detailed sales data, customer feedback, and market intelligence to help you find the most profitable and trending products to sell. Their platform analyzes factors like sales volume, growth trajectories, and competition to surface high-potential product opportunities.","2024-08-25 16:33:02","2025-08-30 01:07:21","Tools and Use (Shopify)","shopify-insight"
"6","Tool-Features","How can TS Scout help find high-demand, low-competition dropshipping products?","TS Scout advanced product research tools leverage comprehensive data analysis to help you identify products with high customer demand and low competition in the market. Our platform examines sales trends, market saturation, and other key indicators to surface the most profitable product opportunities for your dropshipping business.","2024-08-26 05:52:03","2025-08-30 01:07:46","Tools and Use","ebay-product-research-tool"
"7","Tool-Features","Can TS Scout Shopify Insight tool identify emerging product niches or categories that are poised for growth?","Yes, tsscout.com's advanced algorithms continuously monitor market trends to help you uncover emerging product niches and categories that are primed for growth in the Shopify dropshipping space. This allows you to get ahead of the competition and capitalize on these high-potential opportunities.","2024-09-02 13:13:29","2025-08-30 01:08:23","Tools and Use (Shopify)","shopify-insight"
"8","Support-Assistance","What are the different subscription plans offered by tsscout.com?","tsscout.com offers a range of subscription plans to cater to the diverse needs of our users. Our plans include a Basic, Standard, and Premium level, each with varying features and capabilities.","2024-09-24 02:03:14","2025-08-30 01:08:50","Policy and Terms",NULL
"9","Tool-Features","How can TS Scout help with TikTok Shops dropshipping?","tsscout.com offers several features to support TikTok Shops dropshipping, including: Identifying trending products that are performing well on TikTok, Researching competitor ads and content on TikTok,  Analyzing user engagement and sales data for TikTok products, Providing curated lists of ""hot"" products to sell on TikTok Shops, and Integrating with your TikTok Shops account to streamline operations","2024-10-18 19:59:40","2025-08-30 01:11:16","Tools and Use (TikTok)","tiktrend-scan-tool"
"10","Tool-Features","How can TS Scout help with Amazon dropshipping?","TS Scout offers several features to support Amazon dropshipping, including: 

1. An ""Amazon Scanner"" tool to quickly research and analyze product data
2. The ability to ""Decide whether to sell a product with confidence"" by viewing metrics like sales trends, ratings, and supplier information
3. Integration with the DropShipping Pro plan, which provides additional Amazon-specific capabilities","2024-10-18 20:00:30","2025-08-30 01:09:42","Tools and Use (Amazon)","amazon-scanner"
"11","Tool-Features","How can TS Scout help with Walmart dropshipping?","TS Scout offers several features to support Walmart dropshipping, including:

1. Walmart product research tools to identify high-performing, profitable items
2. Competitor analysis to see what's selling well on the Walmart marketplace
3. Supplier vetting and evaluation to find reliable Walmart-approved vendors
4. Integration with your Walmart Seller Center account to streamline operations
5. Guidance and support from the tsscout.com team","2024-10-23 03:17:05","2025-08-30 01:10:22","Tools and Use (Walmart)","walmart-watch-tool"
"12","Pricing-Subscriptions","What are the different subscription plans offered by tsscout.com?","tsscout.com offers a range of subscription plans to cater to the diverse needs of our users. Our plans include a Basic, Standard, and Premium level, each with varying features and capabilities.","2024-11-11 10:15:29","2025-08-30 01:10:46","Pricing and Subscriptions",NULL
"13","Pricing-Subscriptions","How do the features and capabilities differ between the subscription plans?","The key differences between our subscription plans lie in the number of product and competitor research reports you can access, the depth of data and analytics provided, as well as the level of customer support and dedicated account management. Our Basic plan offers essential features, while our Standard and Premium plans unlock more advanced tools and insights.","2024-11-13 09:42:54","2024-11-13 09:42:54","Pricing and Subscriptions",NULL
"14","Pricing-Subscriptions","Can I upgrade or downgrade my subscription plan at any time?","Yes, you have the flexibility to upgrade or downgrade your tsscout.com subscription plan at any time to better suit your evolving business needs. We make the process seamless so you can adjust your plan as your requirements change.","2024-11-13 09:44:17","2025-08-30 01:12:03","Pricing and Subscriptions",NULL
"15","Pricing-Subscriptions","Are there any discounts available for annual or long-term subscriptions?","Absolutely, we do offer discounted pricing for customers who commit to an annual or multi-month subscription plan. This allows you to save money in the long run while enjoying the full benefits of tsscout.com.","2024-11-13 09:50:49","2025-08-30 01:12:21","Pricing and Subscriptions",NULL
"16","Pricing-Subscriptions","Are there limits on the number of products or stores I can research per plan?","The number of products and stores you can research varies by subscription plan. Our Basic plan has some limitations, while our Standard and Premium plans offer more flexibility and higher limits. We encourage you to review the plan details to ensure you choose the right fit for your business.","2024-11-13 16:56:35","2024-11-13 16:56:35","Pricing and Subscriptions",NULL
"17","Pricing-Subscriptions","How does the pricing compare to other similar dropshipping tools on the market?","We've designed our pricing to be highly competitive with other leading dropshipping research platforms. Our plans offer exceptional value by providing comprehensive data, advanced analytics, and unparalleled customer support - all at a price point that fits within most businesses' budgets.","2024-11-13 16:57:33","2024-11-13 16:57:33","Pricing and Subscriptions",NULL
"18","Pricing-Subscriptions","Can I cancel my subscription at any time?","The quickest answer is absolutely. You have the freedom to cancel your tsscout.com subscription at any time, no questions asked. We don't believe in locking you into long-term contracts, but we are sure that when you try our tools and you see the advantages of them and what you will gain, you won’t think of canceling your subscription.","2024-11-13 16:58:49","2025-08-30 01:13:12","Pricing and Subscriptions",NULL
"19","Pricing-Subscriptions","What happens if I forget to renew my subscription?","If you forget to renew your tsscout.com subscription, your access to the platform will be temporarily suspended. However, we'll send you reminders leading up to your renewal date to help ensure you don't experience any disruptions in service. Simply log in and renew your plan when you're ready to continue using our tools.","2024-11-13 17:00:03","2025-08-30 01:13:26","Pricing and Subscriptions",NULL
"20","Get-Started","How can I get started with dropshipping on TS Scout?","We encourage users to ""Start your journey of selling with Drop Shipping Pro"" and ""Try all the features of Drop Shipping Premium for 30 days"" by clicking the ""Start 1$ Trial"" button. This allows you to test out the platform before committing to a paid subscription.","2024-11-13 17:28:50","2025-08-30 01:06:30","Get Started",NULL
"21","Get-Started","What is TS Scout?","TS Scout is a subscription-based SaaS platform built to simplify e-commerce growth. It provides real-time analytics, product and competitor insights, and supplier evaluation tools—helping sellers on Amazon, eBay, Walmart, Shopify, TikTok Shop, and AliExpress make smarter, data-driven decisions.","2025-10-26 07:33:27","2025-10-26 07:33:27","Get Started",NULL
